<?xml version="1.0" encoding="UTF-8"?>
<queryservice xmlns="http://www.anyframejava.org/schema/query/mapping" 
	xmlns:xsi="http://www.w3.org/2001/XMLSchema-instance" 
	xsi:schemaLocation="http://www.anyframejava.org/schema/query/mapping http://www.anyframejava.org/schema/query/mapping/anyframe-query-mapping-1.0.xsd ">
	<queries>
		<query id="createMovie">
			<statement>
				INSERT INTO MOVIE (movie_id, title, director, genre_id, actors, runtime, release_date, ticket_price, now_playing, poster_file)
				VALUES (:vo.movieId, :vo.title, :vo.director, :vo.genre.genreId, :vo.actors, :vo.runtime, :vo.releaseDate, :vo.ticketPrice, :vo.nowPlaying, :vo.posterFile)
			</statement>
		</query>

		<query id="updateMovie">
			<statement>
				UPDATE MOVIE 
				SET title = :vo.title,
				    director = :vo.director,
				    genre_id = :vo.genre.genreId,
				    actors = :vo.actors, 
				    runtime = :vo.runtime,
				    release_date = :vo.releaseDate,
				    ticket_price = :vo.ticketPrice,
				    now_playing = :vo.nowPlaying
				WHERE movie_id = :vo.movieId
			</statement>
		</query>

		<query id="removeMovie">
			<statement>
				DELETE FROM MOVIE 
				WHERE movie_id = :vo.movieId
			</statement>
		</query>

		<query id="findMovieByPk">
			<statement>
				SELECT movie_id, title, director, genre_id, actors, runtime, release_date, ticket_price, now_playing, poster_file
				FROM MOVIE
				WHERE movie_id = :vo.movieId
			</statement>
			<result class="org.anyframe.springrest.example.query.domain.Movie">
				<result-mapping column="{genre_id}" attribute="{genre.genreId}" />
			</result>
		</query>
		
		<query id="findMovieList">
			<statement>
				<!--query-findMovieList-START-->
				SELECT movie.movie_id, movie.title, movie.director, genre.name, movie.actors, movie.release_date, movie.now_playing, movie.poster_file, movie.ticket_price
				FROM MOVIE movie, GENRE genre
				WHERE movie.genre_id = genre.genre_id 
				AND title like '%' || :vo.title || '%'
				AND movie.now_playing = :vo.nowPlaying
				<!--query-findMovieList-END-->
			</statement>
			<result class="org.anyframe.springrest.example.query.domain.Movie">
				<result-mapping column="{name}" attribute="{genre.name}" />
			</result>
		</query>		
	</queries>
</queryservice>

