<?xml version="1.0" encoding="UTF-8"?>
<queryservice xmlns="http://www.anyframejava.org/schema/query/mapping" 
	xmlns:xsi="http://www.w3.org/2001/XMLSchema-instance" 
	xsi:schemaLocation="http://www.anyframejava.org/schema/query/mapping http://www.anyframejava.org/schema/query/mapping/anyframe-query-mapping-1.0.xsd ">

	<queries>
		<query id="findXPCommunityList" mappingStyle="upper">
			<statement>
			<!--np-query-findXPCommunityList-START-->
			SELECT
			COMMUNITY_ID, COMMUNITY_NAME, COMMUNITY_DESC, CATEGORY_ID, REG_ID, REG_DATE
			FROM XP_COMMUNITY
			<!--Velocity-Support-findXPCommunityList-START-->
			#if ($SEARCH_CONDITION.length() &gt; 0 &amp;&amp; "0" == $SEARCH_CONDITION)
				WHERE COMMUNITY_NAME like '%' || :SEARCH_KEYWORD || '%'
			#elseif ($SEARCH_CONDITION.length() &gt; 0 &amp;&amp; "1" == $SEARCH_CONDITION)
			    WHERE COMMUNITY_DESC like '%' || :SEARCH_KEYWORD || '%'
			#end
			<!--Velocity-Support-findXPCommunityList-END-->
			ORDER BY REG_DATE DESC		

		<!--np-query-findXPCommunityList-END-->
			</statement>
		</query>
		<query id="findXPCommunityListForTree" isDynamic="true" mappingStyle="upper">
			<statement>
			<!--np-query-findXPCommunityListForTree-START-->
			SELECT * FROM (
				SELECT	CATE.CATEGORY_ID, CATE.CATEGORY_NAME TEXT_NAME, CATE.CATEGORY_NAME, CATE.CATEGORY_DESC, CATE.REG_DATE CATE_REGDATE,
				'' COMMUNITY_ID, '' COMMUNITY_NAME,	'' COMMUNITY_DESC,	'' REG_ID, sysdate REG_DATE, 0 DEPTH
				FROM	XP_CATEGORY CATE

				UNION

				SELECT	COMM.CATEGORY_ID, COMM.COMMUNITY_NAME TEXT_NAME,'' CATEGORY_NAME, '' CATEGORY_DESC, sysdate REGDATE,
				COMM.COMMUNITY_ID,	COMM.COMMUNITY_NAME, COMM.COMMUNITY_DESC, COMM.REG_ID, COMM.REG_DATE, 1 DEPTH
				FROM XP_COMMUNITY COMM
				)
			ORDER BY CATEGORY_ID, DEPTH		

			<!--np-query-findXPCommunityListForTree-END-->
			</statement>
		</query>
		<query id="findXPCommunityListByCategory" mappingStyle="upper">
			<statement>
				SELECT
				COMMUNITY_ID, COMMUNITY_NAME, COMMUNITY_DESC, CATEGORY_ID, REG_ID, REG_DATE, '' UPDATE_YN
				FROM XP_COMMUNITY
				WHERE CATEGORY_ID = :CATEGORY_ID
				ORDER BY REG_DATE DESC
			</statement>
		</query>
		<query id="findXPCommunityListBySearchCondition" mappingStyle="upper">
			<statement>
			<!--np-query-findXPCommunityListBySearchCondition-START-->
			SELECT
			COMMUNITY_ID, COMMUNITY_NAME, COMMUNITY_DESC, CATEGORY_ID, REG_ID, REG_DATE
			FROM XP_COMMUNITY
			WHERE CATEGORY_ID = :CATEGORY_ID
			<!--Velocity-Support-findXPCommunityListBySearchCondition-START-->
			#if ($SEARCH_CONDITION.length() &gt; 0 &amp;&amp; "0" == $SEARCH_CONDITION)
				AND COMMUNITY_NAME like '%' || :SEARCH_KEYWORD || '%'
			#else
			    AND COMMUNITY_DESC like '%' || :SEARCH_KEYWORD || '%'
			#end
			<!--Velocity-Support-findXPCommunityListBySearchCondition-END-->
			ORDER BY REG_DATE DESC		

			<!--np-query-findXPCommunityListBySearchCondition-END-->
			</statement>
		</query>
		<query id="createXPCommunity" isDynamic="true" mappingStyle="upper">
			<statement>
			<!--np-query-createXPCommunity-START-->
			INSERT INTO XP_COMMUNITY
			(COMMUNITY_ID, COMMUNITY_NAME, COMMUNITY_DESC, REG_ID, REG_DATE, CATEGORY_ID)
			VALUES ('COMMUNITY-'|| NEXT VALUE FOR XP_COMMUNITY_ID_SEQ, :COMMUNITY_NAME, :COMMUNITY_DESC, :REG_ID, sysdate, :CATEGORY_ID)		

			<!--np-query-createXPCommunity-END-->
			</statement>
		</query>
		<query id="updateXPCommunity" isDynamic="true" mappingStyle="upper">
			<statement>
				UPDATE XP_COMMUNITY
				SET
				COMMUNITY_NAME = :COMMUNITY_NAME, COMMUNITY_DESC = :COMMUNITY_DESC, CATEGORY_ID =  :CATEGORY_ID, REG_ID = :REG_ID
				WHERE COMMUNITY_ID = :COMMUNITY_ID
			</statement>
		</query>
		<query id="removeXPCommunity" isDynamic="true" mappingStyle="upper">
			<statement>
				DELETE FROM XP_COMMUNITY
				WHERE COMMUNITY_ID = :COMMUNITY_ID
			</statement>
		</query>
	</queries>
</queryservice>